{"daily":[{"change":-0.1,"changePct":-0.7142857142857143,"close":13.9,"date":"2026-10-30","high":13.9,"institutionalNetShares":{"dealer":null,"foreign":null,"investmentTrust":null},"low":13.85,"open":13.9,"trades":25,"turnoverTwd":653651,"volumeShares":47029}],"datasetStatus":{"annual":"unavailable","daily":"current","dividends":"current","financials":"current","ownership":"current","revenue":"current"},"latest":{"dividendYieldPct":4.32,"epsTtm":null,"pbr":0.42,"per":23.56,"revenueYoyPct":-24.843456862315133,"roePct":null},"latestProvenance":{"dividendYieldPct":{"asOfDate":"2026-10-30","availableAt":null,"source":"twse.valuation","sourceUnit":"percent"},"pbr":{"asOfDate":"2026-10-30","availableAt":null,"source":"twse.valuation","sourceUnit":"multiple"},"per":{"asOfDate":"2026-10-30","availableAt":null,"source":"twse.valuation","sourceUnit":"multiple"},"revenueYoyPct":{"asOfDate":"2026-09-30","availableAt":null,"source":"twse.revenue","sourceUnit":"percent"}},"schemaVersion":"1.1.0","security":{"industry":"建材營造","market":"TWSE","name":"皇鼎","securityId":"TWSE:5533","status":"active","symbol":"5533"},"snapshotId":"2026-10-31T11:51:35.660Z"}