{"daily":[{"change":-0.45,"changePct":-2.37467018469657,"close":18.5,"date":"2026-10-30","high":18.95,"institutionalNetShares":{"dealer":null,"foreign":null,"investmentTrust":null},"low":18.4,"open":18.95,"trades":54,"turnoverTwd":1316567,"volumeShares":71001}],"datasetStatus":{"annual":"unavailable","daily":"current","dividends":"current","financials":"current","ownership":"current","revenue":"current"},"latest":{"dividendYieldPct":null,"epsTtm":null,"pbr":1.65,"per":null,"revenueYoyPct":-56.723997833152765,"roePct":null},"latestProvenance":{"pbr":{"asOfDate":"2026-10-30","availableAt":null,"source":"twse.valuation","sourceUnit":"multiple"},"revenueYoyPct":{"asOfDate":"2026-09-30","availableAt":null,"source":"twse.revenue","sourceUnit":"percent"}},"schemaVersion":"1.1.0","security":{"industry":"其他電子業","market":"TWSE","name":"淳安","securityId":"TWSE:6283","status":"active","symbol":"6283"},"snapshotId":"2026-10-31T11:51:35.660Z"}