{"daily":[{"change":-18.5,"changePct":-7.2265625,"close":237.5,"date":"2026-10-30","high":248,"institutionalNetShares":{"dealer":50899,"foreign":-967577,"investmentTrust":0},"low":230.5,"margin":{"asOfDate":"2026-10-30","marginBalanceShares":6444000,"marginChangeShares":115000,"shortBalanceShares":460000,"shortChangeShares":-28000},"open":243,"trades":6409,"turnoverTwd":1150379497,"volumeShares":4876603}],"datasetStatus":{"annual":"unavailable","daily":"current","dividends":"unavailable","financials":"current","ownership":"current","revenue":"current"},"latest":{"dividendYieldPct":0,"epsTtm":null,"pbr":5.75,"per":54.1,"revenueYoyPct":283.61847645258683,"roePct":null},"latestProvenance":{"dividendYieldPct":{"asOfDate":"2026-10-30","availableAt":null,"source":"tpex.valuation","sourceUnit":"percent"},"pbr":{"asOfDate":"2026-10-30","availableAt":null,"source":"tpex.valuation","sourceUnit":"multiple"},"per":{"asOfDate":"2026-10-30","availableAt":null,"source":"tpex.valuation","sourceUnit":"multiple"},"revenueYoyPct":{"asOfDate":"2026-09-30","availableAt":null,"source":"tpex.revenue","sourceUnit":"percent"}},"schemaVersion":"1.1.0","security":{"industry":"其他電子業","market":"TPEX","name":"陽程","securityId":"TPEX:3498","status":"active","symbol":"3498"},"snapshotId":"2026-10-31T11:51:35.660Z"}