{"daily":[{"change":null,"changePct":null,"close":null,"date":"2026-10-30","high":null,"institutionalNetShares":{"dealer":null,"foreign":null,"investmentTrust":null},"low":null,"open":null,"trades":0,"turnoverTwd":0,"volumeShares":0}],"datasetStatus":{"annual":"unavailable","daily":"stale","dividends":"unavailable","financials":"current","ownership":"current","revenue":"current"},"latest":{"dividendYieldPct":0,"epsTtm":null,"pbr":4.51,"per":1685,"revenueYoyPct":11.007689194658033,"roePct":null},"latestProvenance":{"dividendYieldPct":{"asOfDate":"2026-10-30","availableAt":null,"source":"tpex.valuation","sourceUnit":"percent"},"pbr":{"asOfDate":"2026-10-30","availableAt":null,"source":"tpex.valuation","sourceUnit":"multiple"},"per":{"asOfDate":"2026-10-30","availableAt":null,"source":"tpex.valuation","sourceUnit":"multiple"},"revenueYoyPct":{"asOfDate":"2026-09-30","availableAt":null,"source":"tpex.revenue","sourceUnit":"percent"}},"schemaVersion":"1.1.0","security":{"industry":"數位雲端","market":"TPEX","name":"中湛","securityId":"TPEX:6236","status":"active","symbol":"6236"},"snapshotId":"2026-10-31T11:51:35.660Z"}