{"daily":[{"change":-1.05,"changePct":-2.5830258302583027,"close":39.6,"date":"2026-10-30","high":40.35,"institutionalNetShares":{"dealer":null,"foreign":null,"investmentTrust":null},"low":39.6,"open":39.6,"trades":3,"turnoverTwd":119550,"volumeShares":3000}],"datasetStatus":{"annual":"unavailable","daily":"current","dividends":"unavailable","financials":"current","ownership":"current","revenue":"current"},"latest":{"dividendYieldPct":7.58,"epsTtm":null,"pbr":1.56,"per":13.16,"revenueYoyPct":-4.868505452212957,"roePct":null},"latestProvenance":{"dividendYieldPct":{"asOfDate":"2026-10-30","availableAt":null,"source":"tpex.valuation","sourceUnit":"percent"},"pbr":{"asOfDate":"2026-10-30","availableAt":null,"source":"tpex.valuation","sourceUnit":"multiple"},"per":{"asOfDate":"2026-10-30","availableAt":null,"source":"tpex.valuation","sourceUnit":"multiple"},"revenueYoyPct":{"asOfDate":"2026-09-30","availableAt":null,"source":"tpex.revenue","sourceUnit":"percent"}},"schemaVersion":"1.1.0","security":{"industry":"文化創意業","market":"TPEX","name":"鑫傳","securityId":"TPEX:6856","status":"active","symbol":"6856"},"snapshotId":"2026-10-31T11:51:35.660Z"}