{"daily":[{"change":null,"changePct":null,"close":null,"date":"2026-10-30","high":null,"institutionalNetShares":{"dealer":null,"foreign":null,"investmentTrust":null},"low":null,"margin":{"asOfDate":"2026-10-30","marginBalanceShares":0,"marginChangeShares":0,"shortBalanceShares":0,"shortChangeShares":0},"open":null,"trades":0,"turnoverTwd":0,"volumeShares":0}],"datasetStatus":{"annual":"unavailable","daily":"stale","dividends":"unavailable","financials":"current","ownership":"current","revenue":"current"},"latest":{"dividendYieldPct":0,"epsTtm":null,"pbr":1.77,"per":16.95,"revenueYoyPct":17.08472420918773,"roePct":null},"latestProvenance":{"dividendYieldPct":{"asOfDate":"2026-10-30","availableAt":null,"source":"tpex.valuation","sourceUnit":"percent"},"pbr":{"asOfDate":"2026-10-30","availableAt":null,"source":"tpex.valuation","sourceUnit":"multiple"},"per":{"asOfDate":"2026-10-30","availableAt":null,"source":"tpex.valuation","sourceUnit":"multiple"},"revenueYoyPct":{"asOfDate":"2026-09-30","availableAt":null,"source":"tpex.revenue","sourceUnit":"percent"}},"schemaVersion":"1.1.0","security":{"industry":"觀光餐旅","market":"TPEX","name":"亞都麗緻","securityId":"TPEX:5703","status":"active","symbol":"5703"},"snapshotId":"2026-10-31T11:51:35.660Z"}