{"daily":[{"change":0,"changePct":0,"close":123,"date":"2026-10-30","high":123.5,"institutionalNetShares":{"dealer":null,"foreign":null,"investmentTrust":null},"low":121,"open":123,"trades":2232,"turnoverTwd":276576417,"volumeShares":2264653}],"datasetStatus":{"annual":"unavailable","daily":"current","dividends":"current","financials":"current","ownership":"current","revenue":"current"},"latest":{"dividendYieldPct":5.52,"epsTtm":null,"pbr":3.01,"per":14.61,"revenueYoyPct":16.339800499179482,"roePct":null},"latestProvenance":{"dividendYieldPct":{"asOfDate":"2026-10-30","availableAt":null,"source":"twse.valuation","sourceUnit":"percent"},"pbr":{"asOfDate":"2026-10-30","availableAt":null,"source":"twse.valuation","sourceUnit":"multiple"},"per":{"asOfDate":"2026-10-30","availableAt":null,"source":"twse.valuation","sourceUnit":"multiple"},"revenueYoyPct":{"asOfDate":"2026-09-30","availableAt":null,"source":"twse.revenue","sourceUnit":"percent"}},"schemaVersion":"1.1.0","security":{"industry":"電腦及週邊設備","market":"TWSE","name":"神基","securityId":"TWSE:3005","status":"active","symbol":"3005"},"snapshotId":"2026-10-31T11:51:35.660Z"}