{"daily":[{"change":0,"changePct":0,"close":3.18,"date":"2026-10-30","high":3.18,"institutionalNetShares":{"dealer":null,"foreign":null,"investmentTrust":null},"low":3.12,"margin":{"asOfDate":"2026-10-30","marginBalanceShares":0,"marginChangeShares":0,"shortBalanceShares":0,"shortChangeShares":0},"open":3.12,"trades":4,"turnoverTwd":12543,"volumeShares":4001}],"datasetStatus":{"annual":"unavailable","daily":"current","dividends":"unavailable","financials":"current","ownership":"current","revenue":"current"},"latest":{"dividendYieldPct":0,"epsTtm":null,"pbr":1.27,"per":null,"revenueYoyPct":452.1920668058455,"roePct":null},"latestProvenance":{"dividendYieldPct":{"asOfDate":"2026-10-30","availableAt":null,"source":"tpex.valuation","sourceUnit":"percent"},"pbr":{"asOfDate":"2026-10-30","availableAt":null,"source":"tpex.valuation","sourceUnit":"multiple"},"revenueYoyPct":{"asOfDate":"2026-09-30","availableAt":null,"source":"tpex.revenue","sourceUnit":"percent"}},"schemaVersion":"1.1.0","security":{"industry":"其他","market":"TPEX","name":"淳紳","securityId":"TPEX:4529","status":"active","symbol":"4529"},"snapshotId":"2026-10-31T11:51:35.660Z"}