{"daily":[{"change":-1,"changePct":-1.1764705882352942,"close":84,"date":"2026-10-30","high":85,"institutionalNetShares":{"dealer":-4,"foreign":4000,"investmentTrust":0},"low":82,"margin":{"asOfDate":"2026-10-30","marginBalanceShares":780000,"marginChangeShares":0,"shortBalanceShares":2000,"shortChangeShares":0},"open":85,"trades":46,"turnoverTwd":2123680,"volumeShares":25645}],"datasetStatus":{"annual":"unavailable","daily":"current","dividends":"unavailable","financials":"current","ownership":"current","revenue":"current"},"latest":{"dividendYieldPct":0.12,"epsTtm":null,"pbr":2.36,"per":null,"revenueYoyPct":null,"roePct":null},"latestProvenance":{"dividendYieldPct":{"asOfDate":"2026-10-30","availableAt":null,"source":"tpex.valuation","sourceUnit":"percent"},"pbr":{"asOfDate":"2026-10-30","availableAt":null,"source":"tpex.valuation","sourceUnit":"multiple"}},"schemaVersion":"1.1.0","security":{"industry":"生技醫療","market":"TPEX","name":"昱展新藥","securityId":"TPEX:6785","status":"active","symbol":"6785"},"snapshotId":"2026-10-31T11:51:35.660Z"}