{"daily":[{"change":-1.05,"changePct":-2.140672782874618,"close":48,"date":"2026-10-30","high":48.6,"institutionalNetShares":{"dealer":0,"foreign":1000,"investmentTrust":0},"low":48,"margin":{"asOfDate":"2026-10-30","marginBalanceShares":589000,"marginChangeShares":1000,"shortBalanceShares":4000,"shortChangeShares":0},"open":48.6,"trades":43,"turnoverTwd":1357221,"volumeShares":28145}],"datasetStatus":{"annual":"unavailable","daily":"current","dividends":"unavailable","financials":"current","ownership":"current","revenue":"current"},"latest":{"dividendYieldPct":6.67,"epsTtm":null,"pbr":1.98,"per":13.04,"revenueYoyPct":-2.244410687780238,"roePct":null},"latestProvenance":{"dividendYieldPct":{"asOfDate":"2026-10-30","availableAt":null,"source":"tpex.valuation","sourceUnit":"percent"},"pbr":{"asOfDate":"2026-10-30","availableAt":null,"source":"tpex.valuation","sourceUnit":"multiple"},"per":{"asOfDate":"2026-10-30","availableAt":null,"source":"tpex.valuation","sourceUnit":"multiple"},"revenueYoyPct":{"asOfDate":"2026-09-30","availableAt":null,"source":"tpex.revenue","sourceUnit":"percent"}},"schemaVersion":"1.1.0","security":{"industry":"觀光餐旅","market":"TPEX","name":"山富","securityId":"TPEX:2743","status":"active","symbol":"2743"},"snapshotId":"2026-10-31T11:51:35.660Z"}