{"daily":[{"change":-1,"changePct":-3.508771929824561,"close":27.5,"date":"2026-10-30","high":28.55,"institutionalNetShares":{"dealer":null,"foreign":null,"investmentTrust":null},"low":27.45,"open":28.35,"trades":152,"turnoverTwd":4134870,"volumeShares":149166}],"datasetStatus":{"annual":"unavailable","daily":"current","dividends":"current","financials":"current","ownership":"current","revenue":"current"},"latest":{"dividendYieldPct":null,"epsTtm":null,"pbr":1.09,"per":10.22,"revenueYoyPct":-23.861171920700322,"roePct":null},"latestProvenance":{"pbr":{"asOfDate":"2026-10-30","availableAt":null,"source":"twse.valuation","sourceUnit":"multiple"},"per":{"asOfDate":"2026-10-30","availableAt":null,"source":"twse.valuation","sourceUnit":"multiple"},"revenueYoyPct":{"asOfDate":"2026-09-30","availableAt":null,"source":"twse.revenue","sourceUnit":"percent"}},"schemaVersion":"1.1.0","security":{"industry":"汽車工業","market":"TWSE","name":"車王電","securityId":"TWSE:1533","status":"active","symbol":"1533"},"snapshotId":"2026-10-31T11:51:35.660Z"}